{
  "schema_version": "1.0",
  "last_updated": "2026-05-21",
  "framework_name_ar": "الكود السعودي للبناء",
  "framework_name_en": "Saudi Building Code (SBC)",
  "issuing_authority_ar": "هيئة المهندسين السعوديين بالتنسيق مع وزارة الشؤون البلدية والقروية",
  "source_url": "https://sbc.gov.sa",
  "last_verified": "2026-05-21",
  "versions": [
    {
      "version": "SBC 2018",
      "release_year": 2018,
      "status": "سارٍ",
      "notes_ar": "الإصدار الأول المعتمد رسمياً للكود السعودي للبناء، يُشكّل المرجع الإلزامي لجميع مشاريع البناء في المملكة"
    },
    {
      "version": "SBC 2007",
      "release_year": 2007,
      "status": "مُلغى",
      "notes_ar": "الإصدار الأولي التجريبي الذي سبق اعتماد الكود الكامل، تم استبداله بإصدار 2018"
    }
  ],
  "codes": [
    {
      "id": "sbc_201",
      "code_number": "SBC 201",
      "name_ar": "كود المباني العامة",
      "name_en": "General Building Code",
      "scope_ar": "يحدد المتطلبات العامة لتصميم وإنشاء جميع أنواع المباني في المملكة، ويُرسي المبادئ الأساسية للسلامة الإنشائية والحريق والصحة العامة والبيئة",
      "applies_to_ar": ["المباني السكنية بجميع أنواعها", "المباني التجارية والإدارية", "المنشآت الصناعية", "المباني العامة والمؤسسية"],
      "key_requirements_ar": [
        "الحصول على رخصة بناء معتمدة قبل الشروع في أي أعمال إنشائية",
        "الالتزام بالمخططات المعتمدة من البلدية المختصة",
        "توظيف مهندسين مرخصين من هيئة المهندسين السعوديين",
        "الحصول على شهادة إتمام البناء قبل الإشغال",
        "الامتثال لاشتراطات ارتدادات البناء ونسب البناء المعتمدة"
      ],
      "source_url": "https://sbc.gov.sa",
      "last_verified": "2026-05-21",
      "audience": ["مطور", "مالك", "مستثمر"]
    },
    {
      "id": "sbc_301",
      "code_number": "SBC 301",
      "name_ar": "كود الخرسانة",
      "name_en": "Concrete Code",
      "scope_ar": "يُحدد مواصفات تصميم وإنشاء الهياكل الخرسانية المسلحة وسابقة الإجهاد، ويستند إلى المعايير الدولية مع مراعاة الظروف المناخية والجيولوجية السعودية",
      "applies_to_ar": ["الهياكل الخرسانية المسلحة في جميع أنواع المباني", "الأساسات الخرسانية", "الجدران والأسقف الخرسانية"],
      "key_requirements_ar": [
        "تحديد درجة مقاومة الخرسانة (MPa) وفق الحمولات والاستخدام",
        "فحص مواد البناء ومطابقتها للمواصفات السعودية (SASO)",
        "التحقق من نسب الخلط والتشغيل والمعالجة الصحيحة للخرسانة",
        "اشتراطات خاصة للمناطق الساحلية لمقاومة التآكل"
      ],
      "source_url": "https://sbc.gov.sa",
      "last_verified": "2026-05-21",
      "audience": ["مطور", "مالك", "مستثمر"]
    },
    {
      "id": "sbc_302",
      "code_number": "SBC 302",
      "name_ar": "كود الحديد والصلب",
      "name_en": "Steel and Iron Code",
      "scope_ar": "يُحدد مواصفات تصميم وإنشاء الهياكل الصلبية والحديدية وفق معايير الحمولات والمقاومة والثبات الإنشائي",
      "applies_to_ar": ["الهياكل الصلبية للمباني التجارية والصناعية", "الأسطح المعدنية والسقوف الصلبية", "الكمرات والأعمدة الصلبية"],
      "key_requirements_ar": [
        "مطابقة حديد التسليح لمعايير SASO المعتمدة",
        "اشتراطات الحماية من الصدأ والتآكل خاصة في البيئات الساحلية",
        "متطلبات اللحام والوصلات وفق المعايير الدولية",
        "فحص جودة المواد من موردين معتمدين"
      ],
      "source_url": "https://sbc.gov.sa",
      "last_verified": "2026-05-21",
      "audience": ["مطور", "مالك", "مستثمر"]
    },
    {
      "id": "sbc_401",
      "code_number": "SBC 401",
      "name_ar": "كود السباكة",
      "name_en": "Plumbing Code",
      "scope_ar": "يُنظّم تصميم وتركيب أنظمة الصرف الصحي ومياه الشرب والغاز الطبيعي في المباني، بما يكفل السلامة الصحية وجودة المياه وكفاءة استهلاكها",
      "applies_to_ar": ["أنظمة مياه الشرب الداخلية", "أنظمة الصرف الصحي والمياه الرمادية", "توصيلات الغاز الطبيعي الداخلية"],
      "key_requirements_ar": [
        "مطابقة الأنابيب والمعدات لمواصفات SASO",
        "اشتراطات العزل الحراري لأنابيب المياه الساخنة",
        "نظام تصريف الأمطار وعزله عن الصرف الصحي",
        "فحص ضغط الشبكة وعزل الوصلات قبل التشطيب"
      ],
      "source_url": "https://sbc.gov.sa",
      "last_verified": "2026-05-21",
      "audience": ["مطور", "مالك", "مستثمر"]
    },
    {
      "id": "sbc_501",
      "code_number": "SBC 501",
      "name_ar": "كود الكهرباء",
      "name_en": "Electrical Code",
      "scope_ar": "يُحدد اشتراطات تصميم وتركيب الأنظمة الكهربائية في المباني لضمان السلامة الكهربائية وحماية الأرواح والممتلكات من مخاطر الحريق والصعقات الكهربائية",
      "applies_to_ar": ["التمديدات الكهربائية الداخلية لجميع المباني", "لوحات التوزيع الكهربائية", "أنظمة الإضاءة الطارئة ومخارج الطاقة"],
      "key_requirements_ar": [
        "مطابقة المعدات الكهربائية للمواصفات السعودية والدولية",
        "اشتراطات الحماية من الحريق وقواطع الدوائر",
        "التوصيل الأرضي لجميع الأجهزة والهياكل المعدنية",
        "فحص كهربائي من مهندس مرخص قبل الإشغال"
      ],
      "source_url": "https://sbc.gov.sa",
      "last_verified": "2026-05-21",
      "audience": ["مطور", "مالك", "مستثمر"]
    },
    {
      "id": "sbc_601",
      "code_number": "SBC 601",
      "name_ar": "كود الميكانيكا",
      "name_en": "Mechanical Code",
      "scope_ar": "يُنظّم تصميم وتركيب أنظمة التكييف والتهوية وتكييف الهواء (HVAC) لضمان جودة الهواء الداخلي وكفاءة الطاقة والراحة الحرارية في المباني",
      "applies_to_ar": ["أنظمة التكييف المركزي والفردي", "أنظمة التهوية الميكانيكية", "أنظمة استخلاص الهواء والعادم"],
      "key_requirements_ar": [
        "معدلات تجديد الهواء الداخلي وفق نوع الاستخدام",
        "كفاءة أجهزة التكييف وفق متطلبات كود الطاقة SBC 701",
        "عزل القنوات ومتطلبات مقاومة الحريق",
        "صيانة دورية مستندة للكود لضمان جودة الهواء"
      ],
      "source_url": "https://sbc.gov.sa",
      "last_verified": "2026-05-21",
      "audience": ["مطور", "مالك", "مستثمر"]
    },
    {
      "id": "sbc_701",
      "code_number": "SBC 701",
      "name_ar": "كود الطاقة",
      "name_en": "Energy Code",
      "scope_ar": "يُحدد الحد الأدنى لمتطلبات كفاءة الطاقة في المباني الجديدة والمُجدَّدة، بما يتوافق مع أهداف رؤية 2030 في ترشيد الاستهلاك وتقليل الانبعاثات الكربونية",
      "applies_to_ar": ["المباني السكنية الجديدة", "المباني التجارية والإدارية", "عمليات التجديد الجوهري للمباني القائمة"],
      "key_requirements_ar": [
        "متطلبات عزل الجدران والأسقف (R-value) وفق المنطقة المناخية",
        "معايير كفاءة النوافذ والزجاج الخارجي",
        "اشتراطات كفاءة أنظمة الإضاءة (LPD)",
        "متطلبات كفاءة معدات التكييف (EER/COP)",
        "مراجعة طاقة مستقلة للمشاريع الكبيرة"
      ],
      "source_url": "https://sbc.gov.sa",
      "last_verified": "2026-05-21",
      "audience": ["مطور", "مالك", "مستثمر"]
    },
    {
      "id": "sbc_801",
      "code_number": "SBC 801",
      "name_ar": "كود إمكانية الوصول",
      "name_en": "Accessibility Code",
      "scope_ar": "يُلزم المباني العامة والتجارية بتوفير إمكانية الوصول لذوي الاحتياجات الخاصة وكبار السن، وفق مبادئ التصميم الشامل المعتمدة دولياً",
      "applies_to_ar": ["المباني الحكومية والعامة", "المباني التجارية والترفيهية", "مواقف السيارات والمداخل العامة"],
      "key_requirements_ar": [
        "توفير مسارات وصول ومنحدرات مطابقة للمعايير",
        "مصاعد ومرافق معاقين في المباني متعددة الطوابق",
        "دورات مياه مجهَّزة لذوي الاحتياجات الخاصة",
        "لافتات ومؤشرات بنظام بريل وإشارات صوتية",
        "مواقف سيارات مخصصة وفق النسب المطلوبة"
      ],
      "source_url": "https://sbc.gov.sa",
      "last_verified": "2026-05-21",
      "audience": ["مطور", "مالك", "مستثمر"]
    }
  ],
  "buyer_rights": [
    {
      "id": "structural_warranty",
      "right_ar": "ضمان سلامة الهيكل الإنشائي",
      "right_en": "Structural Integrity Warranty",
      "legal_basis_ar": "يُلزم نظام التطوير العقاري والكود السعودي للبناء (SBC 201) المطورَ بضمان سلامة الهيكل الإنشائي لمدة لا تقل عن عشر سنوات من تاريخ شهادة الإتمام",
      "how_to_claim_ar": "يرفع المشتري شكوى لدى هيئة العقار (REGA) أو القضاء المختص مرفقاً بتقرير هندسي معتمد يُثبت وجود خلل إنشائي، ويجوز طلب التحكيم إذا نصّ عليه العقد",
      "source_url": "https://www.rega.gov.sa/ar/regulations",
      "last_verified": "2026-05-21"
    },
    {
      "id": "mep_warranty",
      "right_ar": "ضمان منظومة السباكة والكهرباء والميكانيكا",
      "right_en": "MEP Systems Warranty",
      "legal_basis_ar": "يُلزم المطورَ بضمان سلامة منظومة السباكة والكهرباء والتكييف لمدة لا تقل عن سنتين من تاريخ التسليم وفق أحكام نظام التطوير العقاري",
      "how_to_claim_ar": "يُوثَّق العيب بتقرير فني معتمد ويُقدَّم طلب الإصلاح كتابياً للمطور، وفي حالة رفضه يُرفع للهيئة العامة للعقار أو القضاء",
      "source_url": "https://www.rega.gov.sa/ar/regulations",
      "last_verified": "2026-05-21"
    },
    {
      "id": "hidden_defects_right",
      "right_ar": "حق المطالبة بإصلاح العيوب الخفية",
      "right_en": "Right to Claim Repair of Latent Defects",
      "legal_basis_ar": "يُجيز نظام المعاملات المدنية السعودي للمشتري المطالبةَ بإصلاح العيوب الخفية التي لم تكن ظاهرة عند التسليم، شريطة إثبات أنها كانت موجودة قبل نقل الملكية",
      "how_to_claim_ar": "يحصل المشتري على تقرير هندسي يُوثّق العيب، ثم يُبلّغ المطور كتابياً. في حال الامتناع عن الإصلاح، يرفع دعوى أمام المحكمة التجارية أو يلجأ للتحكيم",
      "source_url": "https://www.rega.gov.sa/ar/regulations",
      "last_verified": "2026-05-21"
    },
    {
      "id": "spec_disclosure_right",
      "right_ar": "حق الإفصاح عن مواصفات البناء قبل البيع",
      "right_en": "Right to Pre-Sale Building Specification Disclosure",
      "legal_basis_ar": "يُلزم نظام المباني والمنشآت البيّاعَ بالإفصاح الكامل عن مواصفات البناء المعتمدة وفئة الكود السعودي المطبّقة في المبنى قبل إتمام عقد البيع",
      "how_to_claim_ar": "يحق للمشتري طلب نسخة من المخططات المعتمدة ورخصة البناء وشهادة الإتمام، وأي حجب لهذه الوثائق يُعدّ مخالفة قابلة للإبلاغ عنها لهيئة العقار",
      "source_url": "https://www.rega.gov.sa/ar/regulations",
      "last_verified": "2026-05-21"
    },
    {
      "id": "completion_certificate_right",
      "right_ar": "شهادة إتمام البناء وفق الكود",
      "right_en": "Certificate of Completion in Accordance with Code",